{
  "schemaVersion": "1.0.0",
  "forkId": "draft-fork-adv-0001",
  "parentReleaseRef": {
    "loopId": "loop.demo.hello-file",
    "semanticVersion": "1.0.0",
    "packageDigest": { "algorithm": "SHA-256", "digestHex": "bd0744455f140b0c49f72b83b21489ea512354a54ae7d43bef4e0489fd31181e", "byteLength": 4096 }
  },
  "forkReason": "Small tweak to node n1's timeout.",
  "initiatingActor": "USER",
  "createdAtUtc": "2026-08-07T10:30:00Z",
  "authorshipContributions": [
    { "contributorId": "user-not-the-original-publisher", "contributionDescription": "Increased n1's timeout from 30s to 60s." }
  ],
  "licenseRef": { "spdxId": "MIT" },
  "attributionRequired": true,
  "licenseCompatibilityFinding": "COMPATIBLE",
  "publication": {
    "publishedLoopId": "loop.demo.hello-file",
    "testsInheritedUnchanged": ["fixture-n1-basic"],
    "testsChangedOrAdded": [],
    "upstreamContributionIntended": false,
    "ownershipTransferred": false
  }
}
