{
  "schemaVersion": "1.0.0",
  "forkId": "draft-fork-0001",
  "parentReleaseRef": {
    "loopId": "loop.demo.hello-file",
    "semanticVersion": "1.0.0",
    "packageDigest": { "algorithm": "SHA-256", "digestHex": "bd0744455f140b0c49f72b83b21489ea512354a54ae7d43bef4e0489fd31181e", "byteLength": 4096 }
  },
  "forkReason": "Want to add a retry policy before the tool call.",
  "initiatingActor": "USER",
  "createdAtUtc": "2026-08-07T10:00:00Z",
  "authorshipContributions": [
    { "contributorId": "user-jbk4bvkqsq", "contributionDescription": "Added a retry policy to node n1." }
  ],
  "licenseRef": { "spdxId": "MIT" },
  "attributionRequired": true,
  "upstreamRelationship": "TRACKING",
  "lastComparedAgainstUpstream": null,
  "authorityDiffSinceFork": null,
  "appliedUpstreamOperations": [],
  "lineageEvents": [
    { "eventId": "lev-1", "eventType": "FORK_CREATED", "occurredAtUtc": "2026-08-07T10:00:00Z", "actor": "USER" }
  ],
  "licenseCompatibilityFinding": null,
  "publication": null
}
